user,source,exact,comment,tags
acct:vah@hypothes.is,https://caselaw.nationalarchives.gov.uk/ewca/crim/2018/1766,"he offender had an antecedent history of eight previous convictions imposed on six previous occasions since 2007 when he was 16 years old. He had convictions for burglary, public order and possession of class A drug offences. Materially, in 2009 he pleaded guilty to two counts of battery and one count of criminal damage for which he was sentenced to a 12-month community order. The victim was his mother. In 2015 he pleaded guilty to an offence of assault occasioning actual bodily harm for which he was sentenced to a term of nine months' imprisonment. That offence had involved violence against another man who had been accused by a former partner.",Previous offences,['AggFactSent']
acct:vah@hypothes.is,https://caselaw.nationalarchives.gov.uk/ewca/crim/2018/1766,"The offender told L, aged seven, to collect her things,",presence of others,['AggFactSent']
acct:vah@hypothes.is,https://caselaw.nationalarchives.gov.uk/ewca/crim/2018/1766,The offender's sons saw what took place from their open bedroom doorway,Vulnerable witness,['AggFactSent']
acct:vah@hypothes.is,https://caselaw.nationalarchives.gov.uk/ewca/crim/2018/1766,grabbed her by the hair and threw her into the bedroom,Vulnerable victim,['AggFactSent']
acct:vah@hypothes.is,https://caselaw.nationalarchives.gov.uk/ewca/crim/2018/1766,pre-sentence report,,['PreSentReport']
acct:vah@hypothes.is,https://caselaw.nationalarchives.gov.uk/ewca/crim/2018/1766,Crown Court,,['SentCourtType']
acct:vah@hypothes.is,https://caselaw.nationalarchives.gov.uk/ewca/crim/2018/1766,Crown Court at Bristol,,['SentCourtName']
acct:vah@hypothes.is,https://caselaw.nationalarchives.gov.uk/ewca/crim/2018/1766,Bristol Magistrates' Court,,['ConvCourtName']
acct:vah@hypothes.is,https://caselaw.nationalarchives.gov.uk/ewca/crim/2018/1766,Magistrates' Court,,['ConvCourtType']
acct:vah@hypothes.is,https://caselaw.nationalarchives.gov.uk/ewca/crim/2018/1766,Both adults had been drinking alcohol,Yes - drinking,['VicIntoxOffence']
acct:vah@hypothes.is,https://caselaw.nationalarchives.gov.uk/ewca/crim/2018/1766,Both adults had been drinking alcohol,Yes - drinking,['OffIntoxOffence']
acct:vah@hypothes.is,https://caselaw.nationalarchives.gov.uk/ewca/crim/2018/1766,offender's two sons,Had children,['OffDependsOffence']
acct:vah@hypothes.is,https://caselaw.nationalarchives.gov.uk/ewca/crim/2018/1766,seven-year-old daughter,Had children,['VicDependsOffence']
acct:vah@hypothes.is,https://caselaw.nationalarchives.gov.uk/ewca/crim/2018/1766,K had been living with the offender,Fixed address,['VicHomeOffence']
acct:vah@hypothes.is,https://caselaw.nationalarchives.gov.uk/ewca/crim/2018/1766,flat,Fixed address,['OffHomeOffence']
acct:vah@hypothes.is,https://caselaw.nationalarchives.gov.uk/ewca/crim/2018/1766,assault by beating,assault by beating,['ConvictOffence']
acct:vah@hypothes.is,https://caselaw.nationalarchives.gov.uk/ewca/crim/2018/1766,five years and four months' imprisonment,five years and four months' imprisonment,['Sentence']
acct:vah@hypothes.is,https://caselaw.nationalarchives.gov.uk/ewca/crim/2018/1766,causing grievous bodily harm with intent,causing grievous bodily harm with intent,['ConvictOffence']
acct:vah@hypothes.is,https://caselaw.nationalarchives.gov.uk/ewca/crim/2018/1766,16 March 2018,16.03.2018,['ConvictPleaDate']
acct:vah@hypothes.is,https://caselaw.nationalarchives.gov.uk/ewca/crim/2018/1766,James Llewhellin,All Male,['OffSex']
acct:vah@hypothes.is,https://caselaw.nationalarchives.gov.uk/ewca/crim/2018/1766,Solicitor General,General Counsel ,['Appellant']
acct:vah@hypothes.is,https://caselaw.nationalarchives.gov.uk/ewca/crim/2017/1851,post office many times,Acquaintance,['OffVicRelation']
acct:vah@hypothes.is,https://caselaw.nationalarchives.gov.uk/ewca/crim/2017/1851,shopkeeper,1,['VicNum']
acct:vah@hypothes.is,https://caselaw.nationalarchives.gov.uk/ewca/crim/2017/1851,shopkeeper,Employed,['VicJobOffence']
acct:vah@hypothes.is,https://caselaw.nationalarchives.gov.uk/ewca/crim/2017/1851,him,All Male,['VicSex']
acct:vah@hypothes.is,https://caselaw.nationalarchives.gov.uk/ewca/crim/2017/1851,shopkeeper,Individual person,['VictimType']
acct:vah@hypothes.is,https://caselaw.nationalarchives.gov.uk/ewca/crim/2017/1851,post office in Bishops Itchington was robbed by three men,Organisation,['VictimType']
acct:vah@hypothes.is,https://caselaw.nationalarchives.gov.uk/ewca/crim/2017/1851,"informed the jury of why they had heard the evidence of the appellant's previous conviction, warned them against prejudice and over-reliance, directed them that they were entitled to consider it when assessing the appellant's explanation and that it was for them to decide how much it assisted them",Warned jury against prejudice and over-reliance of evidence of previous convictions,['JuryInstruct']
acct:vah@hypothes.is,https://caselaw.nationalarchives.gov.uk/ewca/crim/2017/1851,"summing-up informed the jury of why they had heard the evidence of the appellant's previous conviction, warned them against prejudice and over-reliance, directed them that they were entitled to consider it when assessing the appellant's explanation and that it was for them to decide how much it assisted them","Summing up was accurate, evidence should not have caused prejudice ",['ReasonDismiss']
acct:vah@hypothes.is,https://caselaw.nationalarchives.gov.uk/ewca/crim/2017/1851,"this Ruling gives rise to the first ground of appeal. Mr Arnold, who appears on behalf of the appellant, submits that the Recorder erred in admitting the bad character evidence",Trial judge admitted evidence which was prejudicial,['AppealGround']
acct:vah@hypothes.is,https://caselaw.nationalarchives.gov.uk/ewca/crim/2017/1851,The jury would be addressed by experienced counsel and would be properly directed as to the reliance they could place on the conviction.,,['JuryInstruct']
acct:vah@hypothes.is,https://caselaw.nationalarchives.gov.uk/ewca/crim/2017/1851,"The offence had taken place on 8th April, when he and another man had threatened a security guard and stolen a cash box containing £14,500. The robbers had been masked, armed with a sword, and they had made off in a waiting car.",Previous conviction,['AggFactSent']
acct:vah@hypothes.is,https://caselaw.nationalarchives.gov.uk/ewca/crim/2017/1851,bad character evidence,,['ProsEvidTypeTrial']
acct:vah@hypothes.is,https://caselaw.nationalarchives.gov.uk/ewca/crim/2017/1851,appeal will be dismissed,Dismissed,['AppealOutcome']
acct:vah@hypothes.is,https://caselaw.nationalarchives.gov.uk/ewca/crim/2017/1851,He worked full-time as an electrician,Employed,['OffJobOffence']
acct:vah@hypothes.is,https://caselaw.nationalarchives.gov.uk/ewca/crim/2017/1851,prosecution imaging expert,imaging expert,['ProsEvidTypeTrial']
acct:vah@hypothes.is,https://caselaw.nationalarchives.gov.uk/ewca/crim/2017/1851,The appellant's previous conviction for robbery,Previous conviction,['AggFactSent']
acct:vah@hypothes.is,https://caselaw.nationalarchives.gov.uk/ewca/crim/2017/1851,girlfriend,Relationship,['OffRelsOffence']
acct:vah@hypothes.is,https://caselaw.nationalarchives.gov.uk/ewca/crim/2017/1851,refused in his interview to say where he had been at the time of the robbery,,['AggFactSent']
acct:vah@hypothes.is,https://caselaw.nationalarchives.gov.uk/ewca/crim/2017/1851,alibi,Alibi,['DefEvidTypeTrial']
acct:vah@hypothes.is,https://caselaw.nationalarchives.gov.uk/ewca/crim/2017/1851,home,Fixed address,['OffHomeOffence']
acct:vah@hypothes.is,https://caselaw.nationalarchives.gov.uk/ewca/crim/2017/1851,bandana found at the appellant's home and a pair of gloves of the type purchased at Homebase,Clothing from crime in appellant home,['ProsEvidTypeTrial']
acct:vah@hypothes.is,https://caselaw.nationalarchives.gov.uk/ewca/crim/2017/1851,"Evidence that the appellant bought gloves of the exact make and type used by robber 2, using cash passed to him by Baines, and that shortly afterwards Baines bought the axe used in the robbery.",Planning,['AggFactSent']
acct:vah@hypothes.is,https://caselaw.nationalarchives.gov.uk/ewca/crim/2017/1851,axes,Use of a weapon to frighten or injure victim,['AggFactSent']
acct:vah@hypothes.is,https://caselaw.nationalarchives.gov.uk/ewca/crim/2017/1851,CCTV footage of the robbery and the purchase of equipment in Homebase,CCTV footage,['ProsEvidTypeTrial']
acct:vah@hypothes.is,https://caselaw.nationalarchives.gov.uk/ewca/crim/2017/1851,expert evidence,Expert evidence,['ProsEvidTypeTrial']
acct:vah@hypothes.is,https://caselaw.nationalarchives.gov.uk/ewca/crim/2017/1851,Eyewitness,Eyewitness,['ProsEvidTypeTrial']
acct:vah@hypothes.is,https://caselaw.nationalarchives.gov.uk/ewca/crim/2017/1851,"£1,000 in cash",,['AggFactSent']
acct:vah@hypothes.is,https://caselaw.nationalarchives.gov.uk/ewca/crim/2017/1851,appeals against his conviction on count 3 with the leave of the single judge,Against conviction with leave of single judge,['AppealAgainst']
acct:vah@hypothes.is,https://caselaw.nationalarchives.gov.uk/ewca/crim/2017/1851,appellant appeals,Offender,['Appellant']
acct:vah@hypothes.is,https://caselaw.nationalarchives.gov.uk/ewca/crim/2017/1851,"A co-defendant, Matthew Baines",1,['CoDefAccNum']
acct:vah@hypothes.is,https://caselaw.nationalarchives.gov.uk/ewca/crim/2017/1851,"A co-defendant, Matthew Baines",Yes,['CoDef']
acct:vah@hypothes.is,https://caselaw.nationalarchives.gov.uk/ewca/crim/2017/1851,DANIEL  GLEN  HAY,All Male,['OffSex']
acct:vah@hypothes.is,https://caselaw.nationalarchives.gov.uk/ewca/crim/2017/1851,Crown Court,,['SentCourtType']
acct:vah@hypothes.is,https://caselaw.nationalarchives.gov.uk/ewca/crim/2017/1851,Crown Court at Warwick,,['SentCourtName']
acct:vah@hypothes.is,https://caselaw.nationalarchives.gov.uk/ewca/crim/2017/1851,jury,Yes,['Jurytrial']
acct:vah@hypothes.is,https://caselaw.nationalarchives.gov.uk/ewca/crim/2017/1851,5 years' imprisonment,,['Sentence']
acct:vah@hypothes.is,https://caselaw.nationalarchives.gov.uk/ewca/crim/2017/1851,17th February 2017,17.02.2017,['ConvictPleaDate']
acct:vah@hypothes.is,https://caselaw.nationalarchives.gov.uk/ewca/crim/2017/1851,single count of robbery,single count of robbery,['ConvictOffence']
acct:vah@hypothes.is,https://caselaw.nationalarchives.gov.uk/ewca/crim/2017/1851,Crown Court at Warwick,,['ConvCourtName']
acct:vah@hypothes.is,https://caselaw.nationalarchives.gov.uk/ewca/crim/2017/1851,Crown Court,,['ConvCourtType']
acct:vah@hypothes.is,https://caselaw.nationalarchives.gov.uk/ewca/crim/2019/362,"learning disability with an IQ of less than 70,",,['OffMentalOffence']
acct:vah@hypothes.is,https://caselaw.nationalarchives.gov.uk/ewca/crim/2019/362,"(1) the weapon did not shoot bullets; (2) no used had been made of it; (3) the intention was only to use it to make it buzz, to frighten away an intruder; and (4) the previous convictions were not relevant to the offending"," (1) the weapon did not shoot bullets; (2) no used had been made of it; (3) the intention was only to use it to make it buzz, to frighten away an intruder; and (4) the previous convictions were not relevant to the offending",['ReasonSentExcess']
acct:vah@hypothes.is,https://caselaw.nationalarchives.gov.uk/ewca/crim/2019/362,appeal is allowed to the extent we have indicated.,Allowed and sentence replaced by more lenient sentence,['AppealOutcome']
acct:vah@hypothes.is,https://caselaw.nationalarchives.gov.uk/ewca/crim/2019/362,"judge had failed to take account of, or alternatively give any sufficient weight to, the factors relied on in submissions: in particular, as to the type of weapon, the limited nature of the possession, the lack of intention to possess or use in the future, and the lack of convictions for offences of violence.",Trial judge should have put offence in a lower category of seriousness,['AppealGround']
acct:vah@hypothes.is,https://caselaw.nationalarchives.gov.uk/ewca/crim/2019/362,judge gave insufficient weight to the matters raised by him in support of the argument that in the case of the firearms offence there were exceptional circumstances which justified departure from the minimum term,judge gave insufficient weight to the matters raised by him in support of the argument that in the case of the firearms offence there were exceptional circumstances which justified departure from the minimum term,['AppealGround']
acct:vah@hypothes.is,https://caselaw.nationalarchives.gov.uk/ewca/crim/2019/362,extended driving test,,['Ancilliary']
acct:vah@hypothes.is,https://caselaw.nationalarchives.gov.uk/ewca/crim/2019/362,13th August 2018,13.08.2018,[]
acct:vah@hypothes.is,https://caselaw.nationalarchives.gov.uk/ewca/crim/2019/362,concurrent,concurrent,['SentServe']
acct:vah@hypothes.is,https://caselaw.nationalarchives.gov.uk/ewca/crim/2019/362,consecutively,consecutively ,['SentServe']
acct:vah@hypothes.is,https://caselaw.nationalarchives.gov.uk/ewca/crim/2019/362,concurrently,concurrent,['SentServe']
acct:vah@hypothes.is,https://caselaw.nationalarchives.gov.uk/ewca/crim/2019/362,Detention in a young offender institution for a total period of six years two months was imposed,,['Sentence']
acct:vah@hypothes.is,https://caselaw.nationalarchives.gov.uk/ewca/crim/2019/362,the pleas of guilty,plead guilty,['MitFactSent']
acct:vah@hypothes.is,https://caselaw.nationalarchives.gov.uk/ewca/crim/2019/362,he appellant's young age,young age,['MitFactSent']
acct:vah@hypothes.is,https://caselaw.nationalarchives.gov.uk/ewca/crim/2019/362,previous convictions aggravated,,['AggFactSent']
acct:vah@hypothes.is,https://caselaw.nationalarchives.gov.uk/ewca/crim/2019/362,"which diagnosed a learning disability with an IQ of less than 70, and the report of an intermediary.",mental illness or disability,['MitFactSent']
acct:vah@hypothes.is,https://caselaw.nationalarchives.gov.uk/ewca/crim/2019/362,"pre-sentence report referred to the appellant's emotional, behavioural and social difficulties and vulnerability to negative peer pressure. It recommended a community order, but counsel realistically acknowledged that a custodial sentence was inevitable",,['PreSentReport']
acct:vah@hypothes.is,https://caselaw.nationalarchives.gov.uk/ewca/crim/2019/362,"ourt gave guidance which included that circumstances are to be regarded as exceptional where the minimum sentence would result in an arbitrary and disproportionate sentence. In the light of that guidance and the basis of plea, this court in McMahon substituted for the minimum term a sentence of 30 months' imprisonment.",,['SentGuideWhich']
acct:vah@hypothes.is,https://caselaw.nationalarchives.gov.uk/ewca/crim/2019/362,"it being a stun gun, it was not a lethal weapon; that it did not belong to the appellant and he was never in physical possession of it; that his legal possession of it was of a technical nature because it was in his car; that in any event the possession was of short duration; that the appellant had had no intention to possess or use it in the future; and that he had no previous convictions for offences relating to weapons or violence",,['MitFactSent']
acct:vah@hypothes.is,https://caselaw.nationalarchives.gov.uk/ewca/crim/2019/362,pleas of guilty at an early stage,Early stage,['PleaPoint']
acct:vah@hypothes.is,https://caselaw.nationalarchives.gov.uk/ewca/crim/2019/362,pleas of guilty at an early stage,Yes,['Confess/Plead']
acct:vah@hypothes.is,https://caselaw.nationalarchives.gov.uk/ewca/crim/2019/362,irearms offence attracts a minimum term of five years' imprisonment or detention for those over 18 at the date of the offence,,['SentGuideWhich']
acct:vah@hypothes.is,https://caselaw.nationalarchives.gov.uk/ewca/crim/2019/362,dangerous driving and driving while disqualified,dangerous driving and driving while disqualified,['ConvictOffence']
acct:vah@hypothes.is,https://caselaw.nationalarchives.gov.uk/ewca/crim/2019/362,possessing a disguised firearm,,['ConvictOffence']
acct:vah@hypothes.is,https://caselaw.nationalarchives.gov.uk/ewca/crim/2019/362,again released on bail,Bail,['RemandDecision']
acct:vah@hypothes.is,https://caselaw.nationalarchives.gov.uk/ewca/crim/2019/362,"dangerous driving, driving while disqualified and uninsured","dangerous driving, driving while disqualified and uninsured",['ConvictOffence']
acct:vah@hypothes.is,https://caselaw.nationalarchives.gov.uk/ewca/crim/2019/362,entence by the magistrates' court,Magistrates Court,['SentCourtType']
acct:vah@hypothes.is,https://caselaw.nationalarchives.gov.uk/ewca/crim/2019/362,bail,Bail,['RemandDecision']
acct:vah@hypothes.is,https://caselaw.nationalarchives.gov.uk/ewca/crim/2019/362,filled up canisters with fuel to the value of £113 and made off without payment,Did not pay for fuel,['ConvictOffence']
acct:vah@hypothes.is,https://caselaw.nationalarchives.gov.uk/ewca/crim/2019/362,Vauxhall Vectra vehicle while disqualified and uninsured.,Driving while disqualified and uninsured,['ConvictOffence']
acct:vah@hypothes.is,https://caselaw.nationalarchives.gov.uk/ewca/crim/2019/362,disqualification from driving for seven years and one month,disqualification from driving for seven years and one month,['WhatAncilliary']
acct:vah@hypothes.is,https://caselaw.nationalarchives.gov.uk/ewca/crim/2019/362,disqualification from driving for seven years and one month,Yes,['Ancilliary']
acct:vah@hypothes.is,https://caselaw.nationalarchives.gov.uk/ewca/crim/2019/362,At the time of these offences in October and November 2017 the appellant was aged 18,18,['OffAgeOffence']
acct:vah@hypothes.is,https://caselaw.nationalarchives.gov.uk/ewca/crim/2019/362,Crown Court at Manchester,,['ConvCourtName']
acct:vah@hypothes.is,https://caselaw.nationalarchives.gov.uk/ewca/crim/2019/362,Crown Court,,['ConvCourtType']
acct:vah@hypothes.is,https://caselaw.nationalarchives.gov.uk/ewca/crim/2019/362,pplicant applies for leave to appeal in respect of the sentences imposed on him,Offender,['Appellant']
acct:vah@hypothes.is,https://caselaw.nationalarchives.gov.uk/ewca/crim/2013/801,The appellant and his brother,2,['CoDefAccNum']
acct:vah@hypothes.is,https://caselaw.nationalarchives.gov.uk/ewca/crim/2013/801,The appellant was alone with the deceased minutes before the fire was seen by a neighbour.,,['ProsEvidTypeTrial']
acct:vah@hypothes.is,https://caselaw.nationalarchives.gov.uk/ewca/crim/2013/801,Cell site evidence put the appellant in the vicinity of the house very shortly before the fire started,,['ProsEvidTypeTrial']
acct:vah@hypothes.is,https://caselaw.nationalarchives.gov.uk/ewca/crim/2013/801,"(d) Although the appellant's case at trial was that he had bought petrol because the deceased wanted him to fix the children's motorbike in the garden, there was already petrol in the motorbike. The quantity bought by the appellant on the day of the murder was too much for the motorbike.",,['ProsEvidTypeTrial']
acct:vah@hypothes.is,https://caselaw.nationalarchives.gov.uk/ewca/crim/2013/801,petrol can seen on CCTV was found close to the victim's burnt body.,CCTV,['ProsEvidTypeTrial']
acct:vah@hypothes.is,https://caselaw.nationalarchives.gov.uk/ewca/crim/2013/801,appellant is that the judge erred in concluding that the interests of justice mandated admission of the evidence and thus in giving leave for the statement to be read,Judge admitted evidence which should not have been admitted,['AppealGround']
acct:vah@hypothes.is,https://caselaw.nationalarchives.gov.uk/ewca/crim/2013/801,admissible,,['VoirDireOutcome']
acct:vah@hypothes.is,https://caselaw.nationalarchives.gov.uk/ewca/crim/2013/801,directed the jury,Reminder of witness credibility,['JuryInstruct']
acct:vah@hypothes.is,https://caselaw.nationalarchives.gov.uk/ewca/crim/2013/801,voir dire,Yes,['VoirDire']
acct:vah@hypothes.is,https://caselaw.nationalarchives.gov.uk/ewca/crim/2013/801,". He was told that if Tahir gave evidence all his family would be ""disturbed and crushed"". D",,['AggFactSent']
acct:vah@hypothes.is,https://caselaw.nationalarchives.gov.uk/ewca/crim/2013/801,male on a motorcycle had attended Tahir's home in Pakistan and threatened his family if Tahir were to give evidence,,['AggFactSent']
acct:vah@hypothes.is,https://caselaw.nationalarchives.gov.uk/ewca/crim/2013/801,further threat was made to Tahir's wife,,['AggFactSent']
acct:vah@hypothes.is,https://caselaw.nationalarchives.gov.uk/ewca/crim/2013/801,"12. We turn to the disputed evidence. Mohammed Tahir was an acquaintance of the appellant and his brother. On 11 January 2011, following the death of the deceased, he spoke to the police but he refused to make a statement. He said that he was concerned for his safety and that of his family. In March 2011 he disclosed that in 2007 the appellant had discussed with his brother killing Fiza Asif. He put those allegations in a letter, but refused to make a witness statement on account of fear. Eventually, on 30 November 2011 he signed a witness statement. By that time the appellant was in custody, having been charged with murder.",Witness statement,['ProsEvidTypeTrial']
acct:vah@hypothes.is,https://caselaw.nationalarchives.gov.uk/ewca/crim/2013/801,there is no basis for holding that the trial was unfair or that the verdict is unsafe,"Trial was not unfair, verdict is not unsafe",['ReasonDismiss']
acct:vah@hypothes.is,https://caselaw.nationalarchives.gov.uk/ewca/crim/2013/801,dismissed,,['AppealOutcome']
acct:vah@hypothes.is,https://caselaw.nationalarchives.gov.uk/ewca/crim/2013/801,ABDUL  JABBAR,Offender,['Appellant']
acct:vah@hypothes.is,https://caselaw.nationalarchives.gov.uk/ewca/crim/2013/801,"As to expert evidence, the Crown called Dr Swift, a forensic pathologist, and Professor Myers, a burns expert. The defence called Dr Davison, a pathologist. They all agreed that the definitive cause of death was unascertained.",Expert testimony,['ProsEvidTypeTrial']
acct:vah@hypothes.is,https://caselaw.nationalarchives.gov.uk/ewca/crim/2013/801,he appellant lied in saying that he had not bought petrol on 4 January 2011.,Appellant lied,['AggFactSent']
acct:vah@hypothes.is,https://caselaw.nationalarchives.gov.uk/ewca/crim/2013/801,He said that he left the house at Palmerston Road shortly before 20.21 hours.,Offender claims to have alibi,['DefEvidTypeTrial']
acct:vah@hypothes.is,https://caselaw.nationalarchives.gov.uk/ewca/crim/2013/801,The appellant denied presence at the time she died,Offender denies offence,['DefEvidTypeTrial']
acct:vah@hypothes.is,https://caselaw.nationalarchives.gov.uk/ewca/crim/2013/801,"The appellant and Arshad lived at an address in Palmerston Road, Walthamstow together with the deceased and other family members",Fixed address,['VicHomeOffence']
acct:vah@hypothes.is,https://caselaw.nationalarchives.gov.uk/ewca/crim/2013/801,Fiza Asif (Arshad's wife,Married,['VicRelsOffence']
acct:vah@hypothes.is,https://caselaw.nationalarchives.gov.uk/ewca/crim/2013/801,Fiza Asif (Arshad's wife),1,['VicNum']
acct:vah@hypothes.is,https://caselaw.nationalarchives.gov.uk/ewca/crim/2013/801,Fiza Asif (Arshad's wife,Individual person,['VictimType']
acct:vah@hypothes.is,https://caselaw.nationalarchives.gov.uk/ewca/crim/2013/801,Fiza Asif (Arshad's wife,Married,['OffRelsOffence']
acct:vah@hypothes.is,https://caselaw.nationalarchives.gov.uk/ewca/crim/2013/801,Arshad's wife,Relative,['OffVicRelation']
acct:vah@hypothes.is,https://caselaw.nationalarchives.gov.uk/ewca/crim/2013/801,deceased's youngest child,Had children,['VicDependsOffence']
acct:vah@hypothes.is,https://caselaw.nationalarchives.gov.uk/ewca/crim/2013/801,circumstantial evidence,,['ProsEvidTypeTrial']
acct:vah@hypothes.is,https://caselaw.nationalarchives.gov.uk/ewca/crim/2013/801,Fiza Asif (Arshad's wife),All Female,['VicSex']
acct:vah@hypothes.is,https://caselaw.nationalarchives.gov.uk/ewca/crim/2013/801,The appellant and his brother,All Male,['OffSex']
acct:vah@hypothes.is,https://caselaw.nationalarchives.gov.uk/ewca/crim/2013/801,"The appellant and Arshad lived at an address in Palmerston Road,",Fixed address,['OffHomeOffence']
acct:vah@hypothes.is,https://caselaw.nationalarchives.gov.uk/ewca/crim/2013/801,The brother was also acquitted at that stage on count 2,Alleged murder,['AcquitOffence']
acct:vah@hypothes.is,https://caselaw.nationalarchives.gov.uk/ewca/crim/2013/801,He and his brother were both acquitted on count 1,Conspiracy to murder,['AcquitOffence']
acct:vah@hypothes.is,https://caselaw.nationalarchives.gov.uk/ewca/crim/2013/801,8 June 2012,08.07.2012,['ConvictPleaDate']
acct:vah@hypothes.is,https://caselaw.nationalarchives.gov.uk/ewca/crim/2013/801,alleged murder,,['ConvictOffence']
acct:vah@hypothes.is,https://caselaw.nationalarchives.gov.uk/ewca/crim/2013/801,conspiracy to murder,,['ConvictOffence']
acct:vah@hypothes.is,https://caselaw.nationalarchives.gov.uk/ewca/crim/2013/801,jury,Yes,['Jurytrial']
acct:vah@hypothes.is,https://caselaw.nationalarchives.gov.uk/ewca/crim/2013/801,Central Criminal Court,,['ConvCourtName']
acct:vah@hypothes.is,https://caselaw.nationalarchives.gov.uk/ewca/crim/2013/801,Central Criminal Court,Crown Court,['ConvCourtType']
acct:vah@hypothes.is,https://caselaw.nationalarchives.gov.uk/ewca/crim/2012/720,judge took into account all relevant factors,judge took into account all relevant factors,['ReasonDismiss']
acct:vah@hypothes.is,https://caselaw.nationalarchives.gov.uk/ewca/crim/2012/720,that in all the circumstances the applicant's convictions are unsafe.,All circumstances are unsafe,['ReasonQuashConv']
acct:vah@hypothes.is,https://caselaw.nationalarchives.gov.uk/ewca/crim/2012/720,refused,Refused,['AppealOutcome']
acct:vah@hypothes.is,https://caselaw.nationalarchives.gov.uk/ewca/crim/2012/720,applicant's convictions are unsafe.,Conviction is unsafe and unduly excessive,[]
acct:vah@hypothes.is,https://caselaw.nationalarchives.gov.uk/ewca/crim/2012/720,PF,Offender,['Appellant']
