user,source,exact,comment,tags
acct:vah@hypothes.is,https://caselaw.nationalarchives.gov.uk/ewca/crim/2006/694,Crown Court,,['ConvCourtType']
acct:vah@hypothes.is,https://caselaw.nationalarchives.gov.uk/ewca/crim/2005/1983,quash the order in its entirety and not to replace it by an appropriately worded section 39 order.,,['ReasonQuashConv']
acct:vah@hypothes.is,https://caselaw.nationalarchives.gov.uk/ewca/crim/2005/1983,"we allow this appeal, quash the order made by the Recorder and substitute a new section 39 order in conventional terms.",Allowed,['AppealOutcome']
acct:vah@hypothes.is,https://caselaw.nationalarchives.gov.uk/ewca/crim/2005/1983,On 30 March 2005 the present application was made on behalf of three media companies pursuant to section 159 of the Criminal Justice Act 1988. That section permits a person aggrieved to appeal to the Court of Appeal against “any order restricting the publication of any report of the whole or any part of a trial on indictment or any such ancillary proceedings”. Such an application requires the leave of the Court of Appeal and section 159 provides that “the decision of the Court of Appeal shall be final”.,section 159 of the Criminal Justice Act 1988,['AppealGround']
acct:vah@hypothes.is,https://caselaw.nationalarchives.gov.uk/ewca/crim/2005/1983,against “any order restricting the publication of any report of the whole or any part of a trial on indictment or any such ancillary proceedings”. Such an application requires the leave of the Court of Appeal and section 159 provides that “the decision of the Court of Appeal shall be final”.,Restricted publication of trial reports,['AppealAgainst']
acct:vah@hypothes.is,https://caselaw.nationalarchives.gov.uk/ewca/crim/2005/1983,"two men, S and L",1,['CoDefAccNum']
acct:vah@hypothes.is,https://caselaw.nationalarchives.gov.uk/ewca/crim/2005/1983,three media companies pursuant,Other,['Appellant']
acct:vah@hypothes.is,https://caselaw.nationalarchives.gov.uk/ewca/crim/2005/1983,result of further e-mails between S and L,E-mails,['ProsEvidTypeTrial']
acct:vah@hypothes.is,https://caselaw.nationalarchives.gov.uk/ewca/crim/2005/1983,police had seized two computers belonging to S,Personal comupters,['ProsEvidTypeTrial']
acct:vah@hypothes.is,https://caselaw.nationalarchives.gov.uk/ewca/crim/2005/1983,11 year-old,11,['VicAgeOffence']
acct:vah@hypothes.is,https://caselaw.nationalarchives.gov.uk/ewca/crim/2005/1983,daughter,All female,['VicSex']
acct:vah@hypothes.is,https://caselaw.nationalarchives.gov.uk/ewca/crim/2005/1983,11 year-old daughter,1,['VicNum']
acct:vah@hypothes.is,https://caselaw.nationalarchives.gov.uk/ewca/crim/2005/1983,daughter,Relative,['OffVicRelation']
acct:vah@hypothes.is,https://caselaw.nationalarchives.gov.uk/ewca/crim/2005/1983,daughter,Had children,['OffDependsOffence']
acct:vah@hypothes.is,https://caselaw.nationalarchives.gov.uk/ewca/crim/2005/1983,two men,All men,['OffSex']
acct:vah@hypothes.is,https://caselaw.nationalarchives.gov.uk/ewca/crim/2005/1983,He too pleaded not guilty to conspiracy to rape but was convicted of it on 18 February 2005. He was initially sentenced to 12 years’ imprisonment but the sentence was reduced on review to eight years’ imprisonment,All concurrent,['SentServe']
acct:vah@hypothes.is,https://caselaw.nationalarchives.gov.uk/ewca/crim/2005/1983,He was sentenced to a total of 14 years’ imprisonment on that day but on 4 March 2005 the Recorder reviewed the sentence and reduced it to one of 10 years.,All concurrent,['SentServe']
acct:vah@hypothes.is,https://caselaw.nationalarchives.gov.uk/ewca/crim/2005/1983,He was sentenced to a total of 14 years’ imprisonment on that day but on 4 March 2005 the Recorder reviewed the sentence and reduced it to one of 10 years,,['Sentence']
acct:vah@hypothes.is,https://caselaw.nationalarchives.gov.uk/ewca/crim/2005/1983,He was initially sentenced to 12 years’ imprisonment but the sentence was reduced on review to eight years’ imprisonment,,['Sentence']
acct:vah@hypothes.is,https://caselaw.nationalarchives.gov.uk/ewca/crim/2005/1983,Crown Court at Teeside,,['SentCourtName']
acct:vah@hypothes.is,https://caselaw.nationalarchives.gov.uk/ewca/crim/2005/1983,Crown Court,,['SentCourtType']
acct:vah@hypothes.is,https://caselaw.nationalarchives.gov.uk/ewca/crim/2005/1983,He too pleaded not guilty to conspiracy to rape but was convicted of it on 18 February 2005.,In court,['PleaPoint']
acct:vah@hypothes.is,https://caselaw.nationalarchives.gov.uk/ewca/crim/2005/1983,In due course S pleaded guilty to nine Counts relating to offences contrary to section 1 of the Protection of Children Act 1978. He pleaded not guilty to the conspiracy but was convicted of it on 18 February 2005.,In court,['PleaPoint']
acct:vah@hypothes.is,https://caselaw.nationalarchives.gov.uk/ewca/crim/2005/1983,making and distributing indecent photographs of a child,Making and distributing indecent photographs of a child,['ConvictOffence']
acct:vah@hypothes.is,https://caselaw.nationalarchives.gov.uk/ewca/crim/2005/1983,L was charged with the conspiracy to rape,Conspiracy to rape,['ConvictOffence']
acct:vah@hypothes.is,https://caselaw.nationalarchives.gov.uk/ewca/crim/2005/1983,18 February 2005,18.02.2005,['ConvictPleaDate']
acct:vah@hypothes.is,https://caselaw.nationalarchives.gov.uk/ewca/crim/2005/1983,Crown Court at Teeside,,['ConvCourtName']
acct:vah@hypothes.is,https://caselaw.nationalarchives.gov.uk/ewca/crim/2005/1983,Crown Court,,['ConvCourtType']
acct:vah@hypothes.is,https://caselaw.nationalarchives.gov.uk/ewca/crim/2004/2278,"In those circumstances, we do not consider that there is anything in the argument that the evidence of Mr Vernells should not have been admitted, or that the way in which it was given could in any way render the convictions of these two appellants unsafe. Accordingly, we dismiss these appeals.",No ground for appeal,['ReasonDismiss']
acct:vah@hypothes.is,https://caselaw.nationalarchives.gov.uk/ewca/crim/2004/2278,"Accordingly, we dismiss these appeals",Dismissed,['AppealOutcome']
acct:vah@hypothes.is,https://caselaw.nationalarchives.gov.uk/ewca/crim/2004/2278,gave expert evidence to this extent,Expert testimony,['ProsEvidTypeTrial']
acct:vah@hypothes.is,https://caselaw.nationalarchives.gov.uk/ewca/crim/2004/2278,"It is submitted that this particular Act sets out a procedure which carries within it the seeds of duplicity on the basis that there is a distinction between section 92 and section 101 as to the defences which are available, particularly where the defendants are the partners, where the issue which may have to be determined is whether a defence under section 92(5) is available to that individual, or whether there is a defence only under section 101(4).",Form of indictment,['AppealGround']
acct:vah@hypothes.is,https://caselaw.nationalarchives.gov.uk/ewca/crim/2004/2278,They appeal against conviction with leave of the single judge,Appeal against conviction with leave of the single judge,['AppealAgainst']
acct:vah@hypothes.is,https://caselaw.nationalarchives.gov.uk/ewca/crim/2004/2278,MARK WAKEFIELD AND MARK ANDREW PURSEGLOVE,2,['CoDefAccNum']
acct:vah@hypothes.is,https://caselaw.nationalarchives.gov.uk/ewca/crim/2004/2278,MARK WAKEFIELD AND MARK ANDREW PURSEGLOVE,1,['CoDefAccNum']
acct:vah@hypothes.is,https://caselaw.nationalarchives.gov.uk/ewca/crim/2004/2278,MARK ANDREW PURSEGLOVE,,['Appellant']
acct:vah@hypothes.is,https://caselaw.nationalarchives.gov.uk/ewca/crim/2004/2278,MARK WAKEFIELD,,['Appellant']
acct:vah@hypothes.is,https://caselaw.nationalarchives.gov.uk/ewca/crim/2004/2278,believed that trading was permissible,Was not aware that trading the items was illegal,['DefEvidTypeTrial']
acct:vah@hypothes.is,https://caselaw.nationalarchives.gov.uk/ewca/crim/2004/2278,"compact discs from the appellant Wakefield at the Bionic Records store at the Reading Festival. Having looked at those, he was suspicious as to their authenticity and he seized the stock on the stall",Seized items,['ProsEvidTypeTrial']
acct:vah@hypothes.is,https://caselaw.nationalarchives.gov.uk/ewca/crim/2004/2278,self-employed,Self-employed,['OffJobOffence']
acct:vah@hypothes.is,https://caselaw.nationalarchives.gov.uk/ewca/crim/2004/2278,MARK WAKEFIELD AND MARK ANDREW PURSEGLOVE,All Male,['OffSex']
acct:vah@hypothes.is,https://caselaw.nationalarchives.gov.uk/ewca/crim/2004/2278,relation to him and the money he can spend,,['WhatAncilliary']
acct:vah@hypothes.is,https://caselaw.nationalarchives.gov.uk/ewca/crim/2004/2278,restraining order on behalf of this Court in relation to him and the money he can spend,Yes,['Ancilliary']
acct:vah@hypothes.is,https://caselaw.nationalarchives.gov.uk/ewca/crim/2004/2278,£1.8 million confiscation order that has been made against him,Yes,['Ancilliary']
acct:vah@hypothes.is,https://caselaw.nationalarchives.gov.uk/ewca/crim/2004/2278,sentenced to four months' imprisonment on each count concurrently,,['Sentence']
acct:vah@hypothes.is,https://caselaw.nationalarchives.gov.uk/ewca/crim/2004/2278,£1.8 million confiscation order that has been made against him,£1.8 million confiscation order,['WhatAncilliary']
acct:vah@hypothes.is,https://caselaw.nationalarchives.gov.uk/ewca/crim/2004/2278,sentenced to four months' imprisonment on each count concurrently,Concurrent,['SentServe']
acct:vah@hypothes.is,https://caselaw.nationalarchives.gov.uk/ewca/crim/2004/2278,Crown Court,,['SentCourtType']
acct:vah@hypothes.is,https://caselaw.nationalarchives.gov.uk/ewca/crim/2004/2278,six counts of unauthorised use of trade marks contrary to sections 92(1) and 104(1) of the Trade Marks Act 1994,Unauthorised use of trade marks contrary to sections 92(1) and 104(1) of the Trade Marks Act 1994,['ConvictOffence']
acct:vah@hypothes.is,https://caselaw.nationalarchives.gov.uk/ewca/crim/2004/2278,jury convicted the appellants of the counts with which we are concerned.,Don't know,['JuryDecisionType']
acct:vah@hypothes.is,https://caselaw.nationalarchives.gov.uk/ewca/crim/2004/2278,jury proceeded to consider the matter on the basis of that indictment,Yes,['Jurytrial']
acct:vah@hypothes.is,https://caselaw.nationalarchives.gov.uk/ewca/crim/2004/2278,6th June 2003,06.06.2003,['ConvictPleaDate']
acct:vah@hypothes.is,https://caselaw.nationalarchives.gov.uk/ewca/crim/2004/2278,Crown Court at Reading,,['ConvCourtName']
acct:vah@hypothes.is,https://caselaw.nationalarchives.gov.uk/ewca/crim/2004/2278,Crown Court,,['ConvCourtType']
acct:vah@hypothes.is,https://caselaw.nationalarchives.gov.uk/ewca/crim/2023/231,we find no arguable merit in the applicant's proposed grounds of appeal,,['ReasonDismiss']
acct:vah@hypothes.is,https://caselaw.nationalarchives.gov.uk/ewca/crim/2023/231,refuse the application for an extension of time,Refused,['AppealOutcome']
acct:vah@hypothes.is,https://caselaw.nationalarchives.gov.uk/ewca/crim/2023/231,he applicant raises the issue of his own mental health,,['AppealGround']
acct:vah@hypothes.is,https://caselaw.nationalarchives.gov.uk/ewca/crim/2023/231,applicant lacked the intention necessary for murder,,['AppealGround']
acct:vah@hypothes.is,https://caselaw.nationalarchives.gov.uk/ewca/crim/2023/231,he was not guilty of murder but only of manslaughter on the basis of the law as it is now explained in Jogee,,['AppealGround']
acct:vah@hypothes.is,https://caselaw.nationalarchives.gov.uk/ewca/crim/2023/231,he applicant says that he was advised to plead guilty,,['AppealGround']
acct:vah@hypothes.is,https://caselaw.nationalarchives.gov.uk/ewca/crim/2023/231,application for an extension of time and for leave to appeal against his conviction,Application for extension of time and for leave to appeal,['AppealAgainst']
acct:vah@hypothes.is,https://caselaw.nationalarchives.gov.uk/ewca/crim/2023/231,two co-accused,two co-accused,['CoDefAccNum']
acct:vah@hypothes.is,https://caselaw.nationalarchives.gov.uk/ewca/crim/2023/231,RUBEN  THOMAS  PATRICK  HOATHER,,['Appellant']
acct:vah@hypothes.is,https://caselaw.nationalarchives.gov.uk/ewca/crim/2023/231,"lcohol, cannabis and cocaine were consumed",Offender was intoxicated with drinks & drugs,['AggFactSent']
acct:vah@hypothes.is,https://caselaw.nationalarchives.gov.uk/ewca/crim/2023/231,One stab wound to the back caused death,Expert report,['ProsEvidTypeTrial']
acct:vah@hypothes.is,https://caselaw.nationalarchives.gov.uk/ewca/crim/2023/231,"alcohol, cannabis and cocaine were consumed",Yes - drinking & drugs,['VicIntoxOffence']
acct:vah@hypothes.is,https://caselaw.nationalarchives.gov.uk/ewca/crim/2023/231,Jordan Campbell,All Male,['VicSex']
acct:vah@hypothes.is,https://caselaw.nationalarchives.gov.uk/ewca/crim/2023/231,Jordan Campbell was the applicant's half-brother,1 victim,['VicNum']
acct:vah@hypothes.is,https://caselaw.nationalarchives.gov.uk/ewca/crim/2023/231,half-brother,Individual,['VictimType']
acct:vah@hypothes.is,https://caselaw.nationalarchives.gov.uk/ewca/crim/2023/231,half-brother,Relative,['OffVicRelation']
acct:vah@hypothes.is,https://caselaw.nationalarchives.gov.uk/ewca/crim/2023/231,"which alcohol, cannabis and cocaine were consumed",Yes - drinking & drugs,['OffIntoxOffence']
acct:vah@hypothes.is,https://caselaw.nationalarchives.gov.uk/ewca/crim/2023/231,life imprisonment with a minimum term of 19 years,life imprisonment with a minimum term of 19 years,['Sentence']
acct:vah@hypothes.is,https://caselaw.nationalarchives.gov.uk/ewca/crim/2023/231,Crown Court at Liverpool,,['SentCourtName']
acct:vah@hypothes.is,https://caselaw.nationalarchives.gov.uk/ewca/crim/2023/231,Crown Court,,['SentCourtType']
acct:vah@hypothes.is,https://caselaw.nationalarchives.gov.uk/ewca/crim/2023/231,applicant pleaded guilty to murder.  On the same day he was sentenced,At first appearance in court,['PleaPoint']
acct:vah@hypothes.is,https://caselaw.nationalarchives.gov.uk/ewca/crim/2023/231,applicant pleaded guilty to murder,Yes,['Confess/Plead']
acct:vah@hypothes.is,https://caselaw.nationalarchives.gov.uk/ewca/crim/2023/231,murder,Murder,['ConvictOffence']
acct:vah@hypothes.is,https://caselaw.nationalarchives.gov.uk/ewca/crim/2023/231,6th February 2015,06/02/2015,['ConvictPleaDate']
acct:vah@hypothes.is,https://caselaw.nationalarchives.gov.uk/ewca/crim/2023/231,Crown Court at Liverpool,,['ConvCourtName']
acct:vah@hypothes.is,https://caselaw.nationalarchives.gov.uk/ewca/crim/2023/231,Crown Court,,['ConvCourtType']
acct:vah@hypothes.is,https://caselaw.nationalarchives.gov.uk/ewca/crim/2022/83,We grant the necessary extension of time and we grant leave,Allowed and convicted,['AppealOutcome']
acct:vah@hypothes.is,https://caselaw.nationalarchives.gov.uk/ewca/crim/2022/83,application for an extension of time of 670 days for leave to appeal sentence,Application for extension of time to appeal,['AppealAgainst']
acct:vah@hypothes.is,https://caselaw.nationalarchives.gov.uk/ewca/crim/2022/83,RHYS MORAR,,['Appellant']
acct:vah@hypothes.is,https://caselaw.nationalarchives.gov.uk/ewca/crim/2022/83,RHYS MORAR,All Male,['OffSex']
acct:vah@hypothes.is,https://caselaw.nationalarchives.gov.uk/ewca/crim/2022/83,"total sentence of 59 months' imprisonment, concurrent sentences of equal length being imposed on two counts of being concerned in the supply of class A drugs",two concurrent sentences,['SentServe']
acct:vah@hypothes.is,https://caselaw.nationalarchives.gov.uk/ewca/crim/2022/83,"total sentence of 59 months' imprisonment, concurrent sentences of equal length",59 months' imprisonment,['Sentence']
acct:vah@hypothes.is,https://caselaw.nationalarchives.gov.uk/ewca/crim/2022/83,Crown Court at Chelmsford,,['SentCourtName']
acct:vah@hypothes.is,https://caselaw.nationalarchives.gov.uk/ewca/crim/2022/83,Crown Court,,['SentCourtType']
acct:vah@hypothes.is,https://caselaw.nationalarchives.gov.uk/ewca/crim/2022/83,Following his earlier guilty pleas,,['Confess/Plead']
acct:vah@hypothes.is,https://caselaw.nationalarchives.gov.uk/ewca/crim/2022/83,"two counts of being concerned in the supply of class A drugs, contrary to section 4(3)(b) of the Misuse of Drugs Act 1971",Supply of class A drugs,['ConvictOffence']
acct:vah@hypothes.is,https://caselaw.nationalarchives.gov.uk/ewca/crim/2022/83,16 January 2020,16.01.2020,['ConvictPleaDate']
acct:vah@hypothes.is,https://caselaw.nationalarchives.gov.uk/ewca/crim/2022/83,Crown Court at Chelmsford,,['ConvCourtName']
acct:vah@hypothes.is,https://caselaw.nationalarchives.gov.uk/ewca/crim/2022/83,Crown Court,,['ConvCourtType']
acct:vah@hypothes.is,https://caselaw.nationalarchives.gov.uk/ewca/crim/2009/1431,"racially aggravated intentional harassment, alarm or distress",,['ConvictOffence']
acct:vah@hypothes.is,https://caselaw.nationalarchives.gov.uk/ewca/crim/2009/1431,It cannot be said that the total sentence was wrong in principle or manifestly excessive.,,['ReasonDismiss']
acct:vah@hypothes.is,https://caselaw.nationalarchives.gov.uk/ewca/crim/2009/1431,"In other words when looked at overall is 7 years and 3 months the appropriate sentence for what this man did? We have come to the conclusion that it is. It cannot be said that the total sentence was wrong in principle or manifestly excessive. Despite the attract and persuasive argument put forward by Mr Harbage, this appeal is dismissed.",RSE_is_not Unduly Excessive,['ReasonSentExcess']
acct:vah@hypothes.is,https://caselaw.nationalarchives.gov.uk/ewca/crim/2009/1431,this appeal is dismissed,Dismissed,['AppealOutcome']
acct:vah@hypothes.is,https://caselaw.nationalarchives.gov.uk/ewca/crim/2009/1431,"Although the two offences are different, they are both manifestations of the appellant's right wing ideology and both were committed over the same time period. As such the general rule is that concurrent sentences are appropriate","""Although the two offences are different, they are both manifestations of the appellant's right wing ideology and both were committed over the same time period. As such the general rule is that concurrent sentences are appropriate.""",['AppealGround']
acct:vah@hypothes.is,https://caselaw.nationalarchives.gov.uk/ewca/crim/2009/1431,"the appellant was not a threat to national security. He was not part of a conspiracy, or a terrorist cell. He had not actually manufactured an explosive device. Nor had he gone so far as to attempt to manufacture one and he relies strongly on the fact that there was no evidence that any attack was actually planned or imminent.","he appellant was not a threat to national security. He was not part of a conspiracy, or a terrorist cell. He had not actually manufactured an explosive device. Nor had he gone so far as to attempt to manufacture one and he relies strongly on the fact that there was no evidence that any attack was actually planned or imminent",['AppealGround']
acct:vah@hypothes.is,https://caselaw.nationalarchives.gov.uk/ewca/crim/2009/1431,he relies on the well-known principle of totality.,,['AppealAgainst']
acct:vah@hypothes.is,https://caselaw.nationalarchives.gov.uk/ewca/crim/2009/1431,that the sentences should be concurrent rather than consecutive,,['AppealAgainst']
acct:vah@hypothes.is,https://caselaw.nationalarchives.gov.uk/ewca/crim/2009/1431,He submitted firstly that the 6 year sentence of imprisonment on count 2 was too long,Sentence is unduly excessive,['AppealAgainst']
acct:vah@hypothes.is,https://caselaw.nationalarchives.gov.uk/ewca/crim/2009/1431,NATHAN LUKE WORRELL,Offender,['Appellant']
acct:vah@hypothes.is,https://caselaw.nationalarchives.gov.uk/ewca/crim/2009/1431,"There is a record of convictions going back to 1995. In August 1995 he was sent to prison for 4 year for various offences of robbery and attempted robbery. In 1999 he was before the court for possessing an offensive weapons in public. In 2001 he was before the Grimsby and Cleethorpe Magistrates for having an article with a blade. Later the same year he was before the Great Grimsby Crown Court for possessing written material which was threatening, abusive or insulting and he received a sentence of imprisonment of 12 months.",Offender had previous (relevant) convictions,['AggFactSent']
acct:vah@hypothes.is,https://caselaw.nationalarchives.gov.uk/ewca/crim/2009/1431,form of stickers being placed on a lamppost immediately adjacent and near to the back gate of the Chowdherys and on the gate itself.,Racist stickers,['ProsEvidTypeTrial']
acct:vah@hypothes.is,https://caselaw.nationalarchives.gov.uk/ewca/crim/2009/1431,harassment,Victim testimony,['ProsEvidTypeTrial']
acct:vah@hypothes.is,https://caselaw.nationalarchives.gov.uk/ewca/crim/2009/1431,Chowdherys and on the gate itself.,Fixed address,['VicHomeOffence']
acct:vah@hypothes.is,https://caselaw.nationalarchives.gov.uk/ewca/crim/2009/1431,their daughter's safety.,Had children,['VicDependsOffence']
acct:vah@hypothes.is,https://caselaw.nationalarchives.gov.uk/ewca/crim/2009/1431,"couple, Mr and Mrs Chowdhery.",Married,['VicRelsOffence']
acct:vah@hypothes.is,https://caselaw.nationalarchives.gov.uk/ewca/crim/2009/1431,Mr and Mrs Chowdhery,Male & Female,['VicSex']
acct:vah@hypothes.is,https://caselaw.nationalarchives.gov.uk/ewca/crim/2009/1431,Mr and Mrs Chowdhery,2,['VicNum']
acct:vah@hypothes.is,https://caselaw.nationalarchives.gov.uk/ewca/crim/2009/1431,Mr and Mrs Chowdhery,Individuals,['VictimType']
acct:vah@hypothes.is,https://caselaw.nationalarchives.gov.uk/ewca/crim/2009/1431,They lived on the same estate as the appellant,Neighbours ,['OffVicRelation']
acct:vah@hypothes.is,https://caselaw.nationalarchives.gov.uk/ewca/crim/2009/1431,one bedroomed flat on a council estate,Fixed address,['OffHomeOffence']
acct:vah@hypothes.is,https://caselaw.nationalarchives.gov.uk/ewca/crim/2009/1431,27th March 1973,35 years old,['OffAgeOffence']
acct:vah@hypothes.is,https://caselaw.nationalarchives.gov.uk/ewca/crim/2009/1431,that the sentences should be concurrent rather than consecutive,Consecutive,['SentServe']
acct:vah@hypothes.is,https://caselaw.nationalarchives.gov.uk/ewca/crim/2009/1431,"Count 1 was racially aggravated intentional harassment, alarm or distress and the sentence was 15 months' imprisonment consecutive to count 2, which was a count of possession of articles for terrorist purposes. For that he received a sentence of 6 years' imprisonment.","Count 1: 15 months' imprisonment
Count 2: 6 years' imprisonment
Total: 7 years and 3 months ",[]
acct:vah@hypothes.is,https://caselaw.nationalarchives.gov.uk/ewca/crim/2009/1431,Crown Court at Grimsby,Crown Court at Grimsby,['SentCourtName']
acct:vah@hypothes.is,https://caselaw.nationalarchives.gov.uk/ewca/crim/2009/1431,Crown Court,Crown Court,['SentCourtType']
acct:vah@hypothes.is,https://caselaw.nationalarchives.gov.uk/ewca/crim/2009/1431,possession of articles for terrorist purposes,,['ConvictOffence']
acct:vah@hypothes.is,https://caselaw.nationalarchives.gov.uk/ewca/crim/2009/1431,jury,Yes,['Jurytrial']
acct:vah@hypothes.is,https://caselaw.nationalarchives.gov.uk/ewca/crim/2009/1431,12th December 2008,12.12.2008,['ConvictPleaDate']
acct:vah@hypothes.is,https://caselaw.nationalarchives.gov.uk/ewca/crim/2009/1431,Crown Court at Grimsby,Crown Court at Grimsby,['ConvCourtName']
acct:vah@hypothes.is,https://caselaw.nationalarchives.gov.uk/ewca/crim/2009/1431,Crown Court,Crown Court,['ConvCourtType']
acct:vah@hypothes.is,https://caselaw.nationalarchives.gov.uk/ewca/crim/2003/3,"Leave to appeal to the House of Lords is, however, refused.",Refused,['AppealOutcome']
acct:vah@hypothes.is,https://caselaw.nationalarchives.gov.uk/ewca/crim/2003/3,"As only one member of the court, Potter LJ, was present for the purposes of handing down the judgment",,['AppealGround']
acct:vah@hypothes.is,https://caselaw.nationalarchives.gov.uk/ewca/crim/2003/3,indecent assault,,['ConvictOffence']
acct:vah@hypothes.is,https://caselaw.nationalarchives.gov.uk/ewca/crim/2003/3,20.12.02,20.12.02,['ConvictPleaDate']
acct:vah@hypothes.is,https://caselaw.nationalarchives.gov.uk/ewca/crim/2003/3,TAUNTON CROWN COURT,Taunton Crown Court,['ConvCourtName']
acct:vah@hypothes.is,https://caselaw.nationalarchives.gov.uk/ewca/crim/2003/3,TAUNTON CROWN COURT,Crown Court,['ConvCourtType']
acct:vah@hypothes.is,https://caselaw.nationalarchives.gov.uk/ewca/crim/2003/3,MICHAEL JONES,,['Appellant']
acct:vah@hypothes.is,https://caselaw.nationalarchives.gov.uk/ewca/crim/2020/499,NICHOLAS WARNER,,['Appellant']
acct:vah@hypothes.is,https://caselaw.nationalarchives.gov.uk/ewca/crim/2020/499,refusing the appellant's request for an opportunity to take legal advice before being asked the questions again,Judge refused appellant's request for an opportunity to take legal advise,['RSE_is']
acct:vah@hypothes.is,https://caselaw.nationalarchives.gov.uk/ewca/crim/2020/499,was a serious procedural unfairness in not fully and clearly explaining to the appellant that any confidentiality had been waived,Serious procedural unfairness,['ReasonQuashConv']
acct:vah@hypothes.is,https://caselaw.nationalarchives.gov.uk/ewca/crim/2020/499,This appeal accordingly succeeds and the finding of contempt of court is quashed,Conviction Quashed,[]
acct:vah@hypothes.is,https://caselaw.nationalarchives.gov.uk/ewca/crim/2020/499,"appropriate advice before the questions were asked for the final time, he would have answered them, because he would then have known in clear terms that any confidentiality",Lack of appropriate legal advise,['AppealGround']
acct:vah@hypothes.is,https://caselaw.nationalarchives.gov.uk/ewca/crim/2020/499,"It was procedurally unfair to refuse him the opportunity, before he was asked for his final answer to the questions, to take legal advice regarding his duty of confidentiality as a religious minister.",Lack of legal consultation,['AppealGround']
acct:vah@hypothes.is,https://caselaw.nationalarchives.gov.uk/ewca/crim/2020/499,the appellant had not acted out of wilful defiance or disrespect to the court,Sentence is excessive,['AppealAgainst']
